{
  "schemaVersion": 1,
  "execution": {
    "taskId": "9007199254740993",
    "attempt": 2
  },
  "findingFingerprint": "fixture:evidence-chain",
  "sourceContentHash": "2222222222222222222222222222222222222222222222222222222222222222",
  "sdkVersion": "0.1.25",
  "adapterVersion": 1,
  "completeness": "complete",
  "nodes": [
    {
      "id": "58957baf6d9d7cd3e3d97272be0af3de7547acc9108a53008c268c748c0d6ac9",
      "kind": "finding",
      "label": "Fixtures / Mock：查询输入进入数据库调用",
      "state": "inferred",
      "stateReason": "SDK 报告或推断；未据此确认实际执行或漏洞复现。",
      "sourcePointer": "/title",
      "sdkEvidenceId": null,
      "location": null,
      "code": null,
      "explanation": null,
      "sourceCheck": "not_checked",
      "sourceFileSha256": null,
      "verification": null
    },
    {
      "id": "85a9c1169ea40d298552ff85a19467faf1c78d7dcd91a4d7ec0b3d69916df8c1",
      "kind": "code_evidence",
      "label": "读取查询参数",
      "state": "inferred",
      "stateReason": "SDK 报告或推断；未据此确认实际执行或漏洞复现。",
      "sourcePointer": "/raw/codeEvidence/0",
      "sdkEvidenceId": "E-source",
      "location": {
        "path": "fixture.ts",
        "startLine": 2,
        "endLine": null
      },
      "code": "const query = request.query.q;",
      "explanation": "合成代码证据；确认代码存在不等于验证漏洞。",
      "sourceCheck": "not_checked",
      "sourceFileSha256": null,
      "verification": null
    },
    {
      "id": "6d7b142bbf859ad87de841ad9369da82ba9a1554efbae82ab6718a35a145f440",
      "kind": "code_evidence",
      "label": "数据库调用",
      "state": "inferred",
      "stateReason": "SDK 报告或推断；未据此确认实际执行或漏洞复现。",
      "sourcePointer": "/raw/codeEvidence/1",
      "sdkEvidenceId": "E-sink",
      "location": {
        "path": "fixture.ts",
        "startLine": 3,
        "endLine": null
      },
      "code": "database.execute(query);",
      "explanation": "合成危险操作证据。",
      "sourceCheck": "not_checked",
      "sourceFileSha256": null,
      "verification": null
    },
    {
      "id": "87542a0ee19eb47090d025bb0bc3b3eaace015ae0be854d6e856c6857bb8d6bc",
      "kind": "root_cause",
      "label": "SDK 假设：查询参数缺少约束",
      "state": "inferred",
      "stateReason": "SDK 报告或推断；未据此确认实际执行或漏洞复现。",
      "sourcePointer": "/raw/rootCause",
      "sdkEvidenceId": null,
      "location": null,
      "code": null,
      "explanation": null,
      "sourceCheck": "not_checked",
      "sourceFileSha256": null,
      "verification": null
    },
    {
      "id": "302b23531a67f09efbb18c6d1429631233894a09615e03c968eac7141a80770c",
      "kind": "step",
      "label": "SDK 推断的输入传播路径",
      "state": "inferred",
      "stateReason": "SDK 报告或推断；未据此确认实际执行或漏洞复现。",
      "sourcePointer": "/raw/attackPath",
      "sdkEvidenceId": null,
      "location": null,
      "code": null,
      "explanation": null,
      "sourceCheck": "not_checked",
      "sourceFileSha256": null,
      "verification": null
    },
    {
      "id": "1cba5b14406e8b24b1041c3a9abb4187f899c03c8cc62ae0a93f4afac044dd46",
      "kind": "step",
      "label": "查询参数流向数据库调用",
      "state": "inferred",
      "stateReason": "SDK 报告或推断；未据此确认实际执行或漏洞复现。",
      "sourcePointer": "/raw/attackPath/dataFlow",
      "sdkEvidenceId": null,
      "location": null,
      "code": null,
      "explanation": null,
      "sourceCheck": "not_checked",
      "sourceFileSha256": null,
      "verification": null
    },
    {
      "id": "be4c5011c2e3c97659aa7a465243c788135c54f303fee465182eddcc675956d1",
      "kind": "source",
      "label": "request.query.q",
      "state": "inferred",
      "stateReason": "SDK 报告或推断；未据此确认实际执行或漏洞复现。",
      "sourcePointer": "/raw/attackPath/dataFlow/source",
      "sdkEvidenceId": null,
      "location": null,
      "code": null,
      "explanation": null,
      "sourceCheck": "not_checked",
      "sourceFileSha256": null,
      "verification": null
    },
    {
      "id": "0d2740f9eb5ccc05ae3f720df4169cbe7db42de1374a90f57af3e1290812b710",
      "kind": "sink",
      "label": "database.execute",
      "state": "inferred",
      "stateReason": "SDK 报告或推断；未据此确认实际执行或漏洞复现。",
      "sourcePointer": "/raw/attackPath/dataFlow/sink",
      "sdkEvidenceId": null,
      "location": null,
      "code": null,
      "explanation": null,
      "sourceCheck": "not_checked",
      "sourceFileSha256": null,
      "verification": null
    },
    {
      "id": "70ce4eb704af1d4d490263eaad7a22be8d93edf30f47f996a17163ad0ac1e233",
      "kind": "step",
      "label": "将参数赋给 query",
      "state": "inferred",
      "stateReason": "SDK 报告或推断；未据此确认实际执行或漏洞复现。",
      "sourcePointer": "/raw/attackPath/dataFlow/transformations/0",
      "sdkEvidenceId": null,
      "location": null,
      "code": null,
      "explanation": null,
      "sourceCheck": "not_checked",
      "sourceFileSha256": null,
      "verification": null
    },
    {
      "id": "6e914df3afe02b5a73d690dbb0329130a1589e74d91dde4d5b7b6d354431d505",
      "kind": "step",
      "label": "读取外部参数",
      "state": "inferred",
      "stateReason": "SDK 报告或推断；未据此确认实际执行或漏洞复现。",
      "sourcePointer": "/raw/attackPath/steps/0",
      "sdkEvidenceId": null,
      "location": null,
      "code": null,
      "explanation": null,
      "sourceCheck": "not_checked",
      "sourceFileSha256": null,
      "verification": null
    },
    {
      "id": "5210894336575049d09f7b4eb27ff3f2c547f853eb1dad5e1e0fd6d3ec9f58ca",
      "kind": "step",
      "label": "执行数据库调用",
      "state": "inferred",
      "stateReason": "SDK 报告或推断；未据此确认实际执行或漏洞复现。",
      "sourcePointer": "/raw/attackPath/steps/1",
      "sdkEvidenceId": null,
      "location": null,
      "code": null,
      "explanation": null,
      "sourceCheck": "not_checked",
      "sourceFileSha256": null,
      "verification": null
    },
    {
      "id": "c6f3fd83bfd941013edc05a1f6930392ed55d6fc89a69abd1b823b75092f4efe",
      "kind": "assumption",
      "label": "假设上游没有进行参数约束",
      "state": "inferred",
      "stateReason": "SDK 报告或推断；未据此确认实际执行或漏洞复现。",
      "sourcePointer": "/raw/attackPath/assumptions/0",
      "sdkEvidenceId": null,
      "location": null,
      "code": null,
      "explanation": null,
      "sourceCheck": "not_checked",
      "sourceFileSha256": null,
      "verification": null
    },
    {
      "id": "dcad90773f5582f5190c3f896a8436c3c988e4c207ea2b10b6ae6e3832e8c643",
      "kind": "control",
      "label": "需要检查数据库驱动的参数化行为",
      "state": "inferred",
      "stateReason": "SDK 报告或推断；未据此确认实际执行或漏洞复现。",
      "sourcePointer": "/raw/attackPath/controls/0",
      "sdkEvidenceId": null,
      "location": null,
      "code": null,
      "explanation": null,
      "sourceCheck": "not_checked",
      "sourceFileSha256": null,
      "verification": null
    },
    {
      "id": "b465b6545b36608a17107a856c6c6e054ec4460c56cf1654aed50c70d7873e60",
      "kind": "validation",
      "label": "SDK 复核声称 reportable；本合成样本未执行独立复现",
      "state": "inferred",
      "stateReason": "SDK 报告或推断；未据此确认实际执行或漏洞复现。",
      "sourcePointer": "/raw/validation",
      "sdkEvidenceId": null,
      "location": null,
      "code": null,
      "explanation": null,
      "sourceCheck": "not_checked",
      "sourceFileSha256": null,
      "verification": null
    },
    {
      "id": "f8dcf5202e8a0ad99038be48822699d1cc970272e181b71e3cec3ed0679602bb",
      "kind": "counter_evidence",
      "label": "上游中间件可能已约束输入",
      "state": "inferred",
      "stateReason": "SDK 报告或推断；未据此确认实际执行或漏洞复现。",
      "sourcePointer": "/raw/validation/counterEvidence/0",
      "sdkEvidenceId": null,
      "location": null,
      "code": null,
      "explanation": null,
      "sourceCheck": "not_checked",
      "sourceFileSha256": null,
      "verification": null
    },
    {
      "id": "e846a79f5954b0287482f415e981ec4d8a024e82b764cc30a703f92baffe64a9",
      "kind": "limitation",
      "label": "未提供实际请求与运行轨迹",
      "state": "inferred",
      "stateReason": "SDK 报告或推断；未据此确认实际执行或漏洞复现。",
      "sourcePointer": "/raw/validation/limitations/0",
      "sdkEvidenceId": null,
      "location": null,
      "code": null,
      "explanation": null,
      "sourceCheck": "not_checked",
      "sourceFileSha256": null,
      "verification": null
    }
  ],
  "edges": [
    {
      "id": "6847b9919ef46acfa3029ce1d28c0e8d543e70907bfd90465ffd616d1079535a",
      "from": "58957baf6d9d7cd3e3d97272be0af3de7547acc9108a53008c268c748c0d6ac9",
      "to": "85a9c1169ea40d298552ff85a19467faf1c78d7dcd91a4d7ec0b3d69916df8c1",
      "kind": "calls",
      "state": "inferred",
      "sourcePointer": "/raw/codeEvidence/0",
      "reason": "漏洞结果包含此证据条目；不推定该条目证明整个漏洞。"
    },
    {
      "id": "988c773d0b04b1371ce819c02d2593efc3e82e4c4024f4f2e21161244cd277ea",
      "from": "58957baf6d9d7cd3e3d97272be0af3de7547acc9108a53008c268c748c0d6ac9",
      "to": "6d7b142bbf859ad87de841ad9369da82ba9a1554efbae82ab6718a35a145f440",
      "kind": "contains",
      "state": "inferred",
      "sourcePointer": "/raw/codeEvidence/1",
      "reason": "漏洞结果包含此证据条目；不推定该条目证明整个漏洞。"
    },
    {
      "id": "271f6846e7fb3b5afc350c45be36f580116e5826d3e336d9d0e8911f370bbfc3",
      "from": "58957baf6d9d7cd3e3d97272be0af3de7547acc9108a53008c268c748c0d6ac9",
      "to": "87542a0ee19eb47090d025bb0bc3b3eaace015ae0be854d6e856c6857bb8d6bc",
      "kind": "contains",
      "state": "inferred",
      "sourcePointer": "/raw/rootCause",
      "reason": "SDK 结果中的分析内容。"
    },
    {
      "id": "70b90d1028b480471a72df1cb2eae899b329a7b8dbb3d7bcb3817099b586dff6",
      "from": "85a9c1169ea40d298552ff85a19467faf1c78d7dcd91a4d7ec0b3d69916df8c1",
      "to": "87542a0ee19eb47090d025bb0bc3b3eaace015ae0be854d6e856c6857bb8d6bc",
      "kind": "supports",
      "state": "inferred",
      "sourcePointer": "/raw/rootCause/evidenceRefs/0",
      "reason": "SDK 通过证据 ID 明确引用；该支持关系仍属于 SDK 分析结论。"
    },
    {
      "id": "3902961bcca1c249862aed57b05ac59fffe776da1978e79bd115ee9457ec5708",
      "from": "6d7b142bbf859ad87de841ad9369da82ba9a1554efbae82ab6718a35a145f440",